title,control_title,Mod,priority,Recommendation Steps/Approach,COST,
Operational Excellence,API Gateway stage logging should be enabled,AWS Well-Architected Framework,P1,"Ensure API Gateway stage logging is enabled. Steps: 1. Open the API Gateway console. 2. Select the API. 3. Under ""Stages,"" select the stage and enable CloudWatch logging. https://docs.aws.amazon.com/apigateway/latest/developerguide/set-up-logging.html",Cost: None/$0 ,
Operational Excellence,Auto Scaling groups with a load balancer should use health checks,AWS Well-Architected Framework,P1,"Ensure Auto Scaling groups with a load balancer use health checks. Steps: 1. Open the EC2 console. 2. Select the Auto Scaling group. 3. Verify and configure health checks under the ""Health Check"" settings. https://docs.aws.amazon.com/autoscaling/ec2/userguide/healthcheck.html",Cost: None/$0 ,
Operational Excellence,CloudFront distributions access logs should be enabled,AWS Well-Architected Framework,P1,"Ensure CloudFront distributions access logs are enabled. Steps: 1. Open the CloudFront console. 2. Select the distribution. 3. Enable logging in the ""General"" settings and specify the S3 bucket. https://docs.aws.amazon.com/AmazonCloudFront/latest/DeveloperGuide/Logging.html",Cost: None/$0 ,
Operational Excellence,CodeBuild projects should have logging enabled,AWS Well-Architected Framework,P1,"Ensure CodeBuild projects have logging enabled. Steps: 1. Open the CodeBuild console. 2. Select the project. 3. In the ""Logs"" section, enable CloudWatch logs. https://docs.aws.amazon.com/codebuild/latest/userguide/how-to-set-up-logs.html",Cost: None/$0 ,
Operational Excellence,ECS task definitions should have logging enabled,AWS Well-Architected Framework,P1,"Ensure ECS task definitions have logging enabled. Steps: 1. Open the ECS console. 2. Select the task definition. 3. In the ""Container definitions,"" configure logging to CloudWatch. https://docs.aws.amazon.com/AmazonECS/latest/developerguide/what-is-ecs.html",Cost: None/$0 ,
Operational Excellence,Elastic Beanstalk enhanced health reporting should be enabled,AWS Well-Architected Framework,P2,"Ensure Elastic Beanstalk enhanced health reporting is enabled. Steps: 1. Open the Elastic Beanstalk console. 2. Select the environment. 3. Under ""Configuration,"" enable enhanced health reporting. https://docs.aws.amazon.com/elasticbeanstalk/latest/dg/health-enhanced.html",Cost: None/$0 ,
Operational Excellence,ELB application and classic load balancer logging should be enabled,AWS Well-Architected Framework,P2,"Ensure ELB application and classic load balancer logging is enabled. Steps: 1. Open the EC2 console. 2. Select the load balancer. 3. Enable access logging under the ""Attributes"" tab. https://docs.aws.amazon.com/elasticloadbalancing/latest/classic/access-log-collection.html",Cost: None/$0 ,
Operational Excellence,RDS DB instances should be integrated with CloudWatch logs,AWS Well-Architected Framework,P1,"Ensure RDS DB instances are integrated with CloudWatch logs. Steps: 1. Open the RDS console. 2. Select the DB instance. 3. In the ""Log exports"" section, enable the desired logs to CloudWatch. https://docs.aws.amazon.com/AmazonRDS/latest/UserGuide/USER_LogAccess.html",Cost: None/$0 ,
Operational Excellence,At least one enabled trail should be present in a region,AWS Well-Architected Framework,P1,Ensure at least one enabled CloudTrail trail is present in a region. Steps: 1. Open the CloudTrail console. 2. Verify that a trail is enabled for the region. https://docs.aws.amazon.com/awscloudtrail/latest/userguide/how-to-creating-trail.html,Cost: None/$0 ,
Operational Excellence,CloudTrail trails should be integrated with CloudWatch logs,AWS Well-Architected Framework,P1,"Ensure CloudTrail trails are integrated with CloudWatch logs. Steps: 1. Open the CloudTrail console. 2. Select the trail. 3. Configure CloudWatch log integration under the ""CloudWatch Logs"" settings. https://docs.aws.amazon.com/awscloudtrail/latest/userguide/logging-data-events-with-cloudwatch.html",Cost: None/$0 ,
Operational Excellence,CloudWatch alarm should have an action configured,AWS Well-Architected Framework,P1,Ensure CloudWatch alarms have an action configured. Steps: 1. Open the CloudWatch console. 2. Select the alarm. 3. Ensure that an action (like sending a notification) is set for the alarm state. https://docs.aws.amazon.com/AmazonCloudWatch/latest/monitoring/AlarmThatSendsEmail.html,Cost: None/$0 ,
Operational Excellence,EC2 instance detailed monitoring should be enabled,AWS Well-Architected Framework,P2,"Ensure EC2 instance detailed monitoring is enabled. Steps: 1. Open the EC2 console. 2. Select the instance. 3. In the ""Monitoring"" tab, enable detailed monitoring. https://docs.aws.amazon.com/AWSEC2/latest/UserGuide/monitoring-instances.html",Cost: None/$0 ,
Operational Excellence,VPC flow logs should be enabled,AWS Well-Architected Framework,P1,"Ensure VPC flow logs are enabled. Steps: 1. Open the VPC console. 2. Select the VPC. 3. Enable flow logs in the ""Flow Logs"" tab and specify the destination. https://docs.aws.amazon.com/vpc/latest/userguide/flow-logs.html",Cost: None/$0 ,
Operational Excellence,AWS Config should be enabled,AWS Well-Architected Framework,P1,Ensure AWS Config is enabled. Steps: 1. Open the AWS Config console. 2. Configure AWS Config to record the necessary resource types and enable configuration history. https://docs.aws.amazon.com/config/latest/developerguide/what-is-aws-config.html,Cost: None/$0 ,
Operational Excellence,SSM managed instance patching should be compliant,AWS Well-Architected Framework,P2,"Ensure SSM managed instance patching is compliant. Steps: 1. Open the Systems Manager console. 2. Select ""Patch Manager."" 3. Review and apply patching compliance reports. https://docs.aws.amazon.com/systems-manager/latest/userguide/patch-manager.html",Cost: None/$0 ,
Organization,Ensure Tag Policies are enabled,Compliance, p1 ,NOT YET ADDED,Cost: None/$0 ,
Organization,Private Certificate Authority,Compliance, p1 ,NOT YET ADDED,Cost: None/$0 ,
Organization,AWS Private CA root certificate authority should be disabled,Compliance, p1 ,NOT YET ADDED,Cost: None/$0 ,
RDS,RDS Aurora clusters should have backtracking enabled,Compliance,P1,"To ensure Amazon RDS Aurora clusters have backtracking enabled , Enable Backtracking: Create a snapshot of the existing Aurora cluster and restore it with backtracking enabled. This allows for point-in-time recovery without relying solely on backups.
""https://repost.aws/knowledge-center/aurora-mysql-cluster-backtrack
https://docs.aws.amazon.com/AmazonRDS/latest/AuroraUserGuide/AuroraMySQL.Managing.Backtrack.html""
",Cost: None/$0 ,
RDS,Aurora MySQL DB clusters should publish audit logs to CloudWatch Logs,Compliance,P2,"Enabling Advanced Auditing on your Aurora MySQL DB cluster allows the system to capture all necessary events for effective monitoring. Next, publish audit logs to CloudWatch by configuring the Amazon RDS console or using the AWS CLI. This step ensures that all database activities are securely logged and stored. Once the logs are in CloudWatch, proceed to set up alerts and monitoring. Use Amazon CloudWatch Logs Insights to analyze these logs and configure alarms to trigger automated actions in response to suspicious activities, enhancing the security and traceability of your database operations
https://docs.aws.amazon.com/AmazonRDS/latest/AuroraUserGuide/AuroraMySQL.Auditing.html",Cost: None/$0 ,
RDS,RDS Aurora PostgreSQL clusters should not be exposed to local file read vulnerability,Compliance, p3 ,NOT YET ADDED,Cost: None/$0 ,
RDS,RDS Aurora clusters should be protected by backup plan,Compliance, p1 ," RDS Aurora clusters must be protected by a robust backup plan. Implement automated backups using Amazon RDS features to create daily snapshots of your database. Enable point-in-time recovery (PITR) to allow restoration to any specific time within the backup retention period, which is crucial for data recovery. Additionally, test your backup and restore processes regularly to ensure they function as expected. ",Cost: None/$0 ,
RDS,RDS DB clusters should have automatic minor version upgrade enabled,Compliance, p2 ,"Modify the DB instance settings, and enable ""Auto Minor Version Upgrade"" under the maintenance settings. Official documentation can be found in the AWS RDS Documentation.
https://docs.aws.amazon.com/config/latest/developerguide/rds-automatic-minor-version-upgrade-enabled.html",Cost: None/$0 ,
RDS,RDS DB clusters should be configured to copy tags to snapshots,Compliance, p3 ,"Modify the RDS DB instance settings via the AWS Console by enabling the ""Copy tags to snapshots"" option under the backup settings
https://aws.amazon.com/about-aws/whats-new/2015/07/amazon-rds-resource-tags-can-now-be-copied-db-snapshots-of-rds-database-instances/",Cost: None/$0 ,
RDS,RDS clusters should have deletion protection enabled,Compliance, p1 ,"To enable this, go to the AWS Management Console, navigate to the RDS section, select the desired DB cluster, and modify it by enabling ""Deletion Protection"" in the settings
https://aws.amazon.com/about-aws/whats-new/2018/09/amazon-rds-now-provides-database-deletion-protection/",Cost: None/$0 ,
RDS,RDS DB clusters should be encrypted with CMK,Compliance, p1 ,"RDS DB clusters should be encrypted with Customer Master Keys (CMK) from AWS Key Management Service (KMS). Create a CMK in the AWS KMS Console, then enable encryption when creating a new DB cluster. For existing clusters, take a snapshot and restore it with encryption enabled
https://docs.aws.amazon.com/AmazonRDS/latest/UserGuide/Overview.Encryption.html",Cost: None/$0 ,
RDS,RDS DB clusters should be encrypted at rest,Compliance, p1 ,"Amazon RDS DB clusters should be encrypted at rest. For new instances, enable encryption during creation by setting --storage-encrypted to true. For existing unencrypted instances, take a snapshot, copy it with encryption enabled, and restore it to create a new encrypted instance
https://docs.aws.amazon.com/AmazonRDS/latest/UserGuide/Overview.Encryption.html",Cost: None/$0 ,
RDS,An RDS event notifications subscription should be configured for critical cluster events,Compliance, p3 ," configure Amazon RDS event notifications for critical cluster events. Start by navigating to the RDS console and selecting ""Event Subscriptions"" under ""Event Notifications."" Then, create a new subscription for your RDS DB cluster, choosing critical event types like availability, backup, and security. Link the subscription to an Amazon SNS topic to receive notifications. Once configured, activate the subscription to stay informed of any critical issues.
https://docs.aws.amazon.com/AmazonRDS/latest/UserGuide/USER_Events.html",Cost: None/$0 ,
RDS,IAM authentication should be configured for RDS clusters,Compliance, p1 ,"Enable IAM DB authentication in the RDS console by modifying the instance settings. Next, create an IAM policy that grants access to the database and attach it to the required IAM roles or users. Update the database to allow connections via IAM, and use AWS authentication tokens instead of passwords for secure access to the RDS instance.
https://docs.aws.amazon.com/AmazonRDS/latest/UserGuide/UsingWithRDS.IAMDBAuth.html",Cost: None/$0 ,
RDS,RDS DB clusters should be configured for multiple Availability Zones,Compliance, p1 ,"RDS instance is set to use Multi-AZ deployment. This can be done when creating a new RDS instance by selecting the Multi-AZ option, or by modifying an existing instance through the RDS console. Multi-AZ deployment ensures that the primary database is replicated to a standby instance in a different Availability Zone, providing increased availability and fault tolerance in case of infrastructure failure.
https://docs.aws.amazon.com/AmazonRDS/latest/UserGuide/Concepts.MultiAZ.html",Cost: None/$0 ,
RDS,RDS database clusters should use a custom administrator username,Compliance, p1 ,"it is recommended to configure your Amazon RDS database clusters with a custom administrator username instead of the default ""admin"" or ""root"". When creating a new RDS instance or modifying an existing one, specify a unique administrator username in the configuration settings. This reduces the risk of brute-force attacks or unauthorized access targeting common default usernames. Additionally, ensure that this custom username follows your organization's security policies and is used in conjunction with strong password policies.
https://docs.aws.amazon.com/AmazonRDS/latest/UserGuide/USER_CreateDBInstance.html",Cost: None/$0 ,
RDS,RDS DB instance and cluster enhanced monitoring should be enabled,Compliance, p2 ,"Enabling Enhanced Monitoring for your Amazon RDS DB instances and clusters is crucial. Enhanced Monitoring provides real-time metrics on database performance, including CPU, memory, and disk usage, which helps in proactive monitoring and issue resolution. To enable it, you can configure Enhanced Monitoring during the creation of a new RDS instance or modify an existing one via the AWS Management Console or CLI by selecting the desired monitoring interval.
https://docs.aws.amazon.com/AmazonRDS/latest/UserGuide/USER_Monitoring.OS.html",Cost: None/$0 ,
RDS,RDS databases and clusters should not use a database engine default port,Compliance, p1 ,"RDS databases and clusters using default database engine ports, start by logging into the AWS Management Console to identify the current port in use. Then, select your RDS instance or cluster, click on Modify, and navigate to the Database options section to change the port to a custom value that avoids commonly used ports. After updating the port, choose to apply the changes either immediately or during the next maintenance window. Ensure that your application configuration reflects this new port and adjust any associated security group rules to allow traffic on it.
https://docs.aws.amazon.com/AmazonRDS/latest/UserGuide/Welcome.html",Cost: None/$0 ,
RDS,RDS DB instance automatic minor version upgrade should be enabled,Compliance, p1 ,"enable automatic minor version upgrades for RDS DB instances, log into the AWS Management Console and select your RDS instance. Click on ""Modify,"" then check the ""Auto minor version upgrade"" option in the DB Engine Version section. Apply the changes immediately or during the next maintenance http://docs.aws.amazon.com/AmazonRDS/latest/UserGuide/USER_UpgradeDBInstance.Maintenance.html#USER_UpgradeDBInstance.AutoMinorVersionUpgrade
",Cost: None/$0 ,
RDS,RDS DB instance backup should be enabled,Compliance, p1 ,"To enable backups for your RDS DB instance, log into the AWS Management Console and select the desired RDS instance. Click on ""Modify"" and navigate to the ""Backup"" section. Ensure that ""Enable Automated Backups"" is checked and configure the backup retention period according to your requirements. After making these changes, apply them immediately or during the next maintenance window
https://docs.aws.amazon.com/AmazonRDS/latest/UserGuide/Welcome.html",Cost: None/$0 ,
RDS,RDS DB instances backup retention period should be greater than or equal to 7,Compliance, p3 ,"To configure the backup retention period for your RDS DB instance to be greater than or equal to seven days, start by logging into the AWS Management Console and selecting the RDS instance in question. Click on ""Modify,"" then scroll to the ""Backup"" section. Here, set the ""Backup Retention Period"" to at least seven days. After making these adjustments, choose to apply the changes immediately or during the next maintenance window
https://docs.aws.amazon.com/AmazonRDS/latest/UserGuide/Welcome.html",Cost: None/$0 ,
RDS,RDS DB instances CA certificates should not expire within next 7 days,Compliance, p3 ,"To ensure that the CA certificates for your RDS DB instances do not expire within the next seven days, first, check the current CA certificate status by logging into the AWS Management Console and navigating to the RDS dashboard. Select your RDS instance and review the certificate information. If the CA certificate is set to expire soon, you will need to modify your RDS instance. Click on ""Modify,"" and under the ""Database Options,"" update the ""Certificate Authority"" to the latest version. After making the necessary changes, apply them immediately or during the next maintenance window to avoid disruptions
https://docs.aws.amazon.com/AmazonRDS/latest/UserGuide/UsingWithRDS.SSL.html",Cost: None/$0 ,
RDS,RDS DB instances should be integrated with CloudWatch logs,Compliance, p1 ,"To integrate your RDS DB instances with Amazon CloudWatch Logs, start by logging into the AWS Management Console and navigating to the RDS dashboard. Select the RDS instance you want to configure, then click on ""Modify."" In the ""Log exports"" section, enable the desired logs you wish to export to CloudWatch Logs, such as error logs or slow query logs. After enabling the logs, choose to apply the changes immediately or during the next maintenance window. Ensure that the appropriate IAM role is assigned to allow RDS to send logs to CloudWatch
https://docs.aws.amazon.com/AmazonRDS/latest/UserGuide/USER_LogAccess.html",Cost: None/$0 ,
RDS,RDS DB instances connections should be encrypted,Compliance, p3 ,"To ensure that connections to RDS DB instances are encrypted, enable SSL (Secure Sockets Layer) for your database connections. Log in to the AWS Management Console, navigate to your RDS instance, and confirm that your application is configured to use SSL by providing the appropriate SSL certificate from AWS. Adjust your database connection string to include SSL parameters.
https://docs.aws.amazon.com/AmazonRDS/latest/UserGuide/UsingWithRDS.SSL.html",Cost: None/$0 ,
RDS,RDS DB instances should be configured to copy tags to snapshots,Compliance, p3 ,"To configure RDS DB instances to copy tags to snapshots, log into the AWS Management Console, navigate to the RDS dashboard, and select your DB instance. Click on Modify, and in the ""Snapshot"" section, enable the option to Copy Tags to Snapshot. Save the changes and choose to apply them immediately or during the next maintenance window.
https://docs.aws.amazon.com/AmazonRDS/latest/UserGuide/Welcome.html",Cost: None/$0 ,
RDS,RDS DB instances should have deletion protection enabled,Compliance, p2 ,"To enable deletion protection for your RDS DB instances, log into the AWS Management Console, navigate to the RDS dashboard, and select the DB instance you want to protect. Click on Modify, and under the Deletion Protection section, set it to Yes. Save the changes and apply them immediately or during the next maintenance window
https://docs.aws.amazon.com/AmazonRDS/latest/UserGuide/Welcome.html",Cost: None/$0 ,
RDS,RDS DB instance encryption at rest should be enabled,Compliance, p1 ,"To enable encryption at rest for RDS DB instances, you need to create a new encrypted DB instance. Log into the AWS Management Console, navigate to RDS, and select Create database. When configuring the database, ensure that the Storage encryption option is enabled. For existing unencrypted instances, take a snapshot and create a new instance from that snapshot with encryption enabled.
https://docs.aws.amazon.com/AmazonRDS/latest/UserGuide/Overview.Encryption.html",Cost: None/$0 ,
RDS,An RDS event notifications subscription should be configured for critical database instance events,Compliance, p3 ,"To configure an RDS event notifications subscription for critical database instance events, log into the AWS Management Console and navigate to the RDS dashboard. Select ""Event subscriptions"" and create a new subscription by selecting the RDS instance and the types of events you want to receive notifications for. Specify the notification method, such as an SNS topic. 
https://docs.aws.amazon.com/AmazonRDS/latest/UserGuide/USER_Events.html#USER_Events.Subscribing",Cost: None/$0 ,
RDS,RDS DB instances should have iam authentication enabled,Compliance, p2 ,"To enable IAM authentication for your RDS DB instances, log into the AWS Management Console and navigate to your RDS instance. Click on Modify, and in the Database options, set IAM DB Authentication to enabled. Save the changes and apply them immediately or during the next maintenance window. Additionally, ensure that your application is configured to use IAM authentication when connecting
https://docs.aws.amazon.com/AmazonRDS/latest/UserGuide/UsingWithRDS.IAMDBAuth.html",Cost: None/$0 ,
RDS,RDS DB instances should be in a backup plan,Compliance, p3 ,"To ensure that your RDS DB instances are included in a backup plan, verify that automated backups are enabled. Log into the AWS Management Console, select your RDS instance, click on Modify, and ensure that the Backup retention period is set to a value greater than 0. Save changes and apply them either immediately or during the next maintenance window
https://docs.aws.amazon.com/AmazonRDS/latest/UserGuide/Welcome.html",Cost: None/$0 ,
RDS,RDS instances should be deployed in a VPC,Compliance, p1 ,"To ensure that your RDS instances are deployed in a Virtual Private Cloud (VPC), verify the settings during instance creation. Log into the AWS Management Console, navigate to the RDS dashboard, and check the ""Network & Security"" settings of your DB instance. Ensure that it is launched within a VPC. If necessary, create a new instance within a VPC
https://docs.aws.amazon.com/AmazonRDS/latest/UserGuide/USER_VPC.html",Cost: None/$0 ,
RDS,Database logging should be enabled,Compliance, p1 ,"To enable database logging for your RDS instances, log into the AWS Management Console, navigate to your RDS instance, and click on Modify. In the Log exports section, select the types of logs you wish to enable (e.g., error logs, general logs, slow query logs). Save the changes and choose to apply them immediately or during the next maintenance window.
https://docs.aws.amazon.com/AmazonRDS/latest/UserGuide/USER_LogAccess.html",Cost: None/$0 ,
RDS,RDS DB instance multiple az should be enabled,Compliance, p2 ,"To enable Multi-AZ deployment for RDS DB instances, log into the AWS Management Console, select your DB instance, and click on Modify. In the Availability & durability section, choose the option for Multi-AZ deployment and save your changes. Apply the modifications either immediately or during the next maintenance window.
https://docs.aws.amazon.com/AmazonRDS/latest/UserGuide/Concepts.MultiAZ.html
",Cost: None/$0 ,
RDS,RDS database instances should use a custom administrator username,Compliance, p1 ,"To set a custom administrator username for your RDS DB instances, log into the AWS Management Console, navigate to the RDS dashboard, and create a new instance. During the creation process, specify your custom username in the DB instance identifier section. If you have existing instances, you may need to create a new instance and migrate data or change the existing username as per your requirements
https://docs.aws.amazon.com/AmazonRDS/latest/UserGuide/Welcome.html",Cost: None/$0 ,
RDS,RDS DB instances should not use public subnet,Compliance, p3 ,"To ensure that your RDS instances do not use public subnets, check the subnet configuration when creating the instance. Log into the AWS Management Console, navigate to the VPC dashboard, and verify that the selected subnet for your RDS instance is private. If needed, launch a new RDS instance in a private subnet
https://docs.aws.amazon.com/AmazonRDS/latest/UserGuide/USER_VPC.html",Cost: None/$0 ,
RDS,RDS PostgreSQL DB instances should not be exposed to local file read vulnerability,Compliance, p3 ,"To protect RDS PostgreSQL instances from local file read vulnerabilities, ensure that the appropriate configurations are set. Verify that the local_file setting is disabled in your instance parameters. Log into the AWS Management Console, navigate to the RDS dashboard, select your PostgreSQL instance, and modify the DB parameter group settings

https://docs.aws.amazon.com/AmazonRDS/latest/UserGuide/Welcome.html",Cost: None/$0 ,
RDS,RDS DB instances should prohibit public access,Compliance, p1 ,"To prohibit public access for RDS DB instances, log into the AWS Management Console and navigate to the RDS dashboard. Select your DB instance and ensure that the ""Public accessibility"" option is set to No. Save changes and apply them either immediately or during the next maintenance window
https://docs.aws.amazon.com/AmazonRDS/latest/UserGuide/Welcome.html",Cost: None/$0 ,
RDS,RDS DB instance should be protected by backup plan,Compliance, p3 ,"To protect your RDS DB instances with a backup plan, ensure that automated backups are enabled. Log into the AWS Management Console, select your RDS instance, and click on Modify. Ensure that the Backup retention period is greater than 0 days, and apply the changes immediately or during the next maintenance window
https://docs.aws.amazon.com/AmazonRDS/latest/UserGuide/Welcome.html",Cost: None/$0 ,
RDS,An RDS event notifications subscription should be configured for critical database parameter group events,Compliance, p3 ,"To configure an RDS event notifications subscription for critical database parameter group events, log into the AWS Management Console, navigate to the RDS dashboard, and select ""Event subscriptions."" Create a new subscription and select the parameter group events you wish to monitor. Specify the notification method, such as an SNS topic.
https://docs.aws.amazon.com/AmazonRDS/latest/UserGuide/USER_Events.html#USER_Events.Subscribing",Cost: None/$0 ,
