title,control_title,Mod,priority,Recommendation Steps/Approach,COST,
Security,EC2 instances should be in a VPC,AWS Well-Architected Framework, p1 ,Ensure EC2 instances are located within a VPC. Steps: 1. Review EC2 instance configurations. 2. Modify settings to ensure they are launched in a VPC. # REF:https://docs.aws.amazon.com/AWSEC2/latest/UserGuide/EC2_GetStarted.html,Cost: None/$0 ,
Security,Lambda functions should restrict public access,AWS Well-Architected Framework, p1 ,Restrict public access to Lambda functions. Steps: 1. Review Lambda function settings. 2. Configure VPC settings to restrict access. # REF:https://docs.aws.amazon.com/lambda/latest/dg/configuration-vpc.html,Cost: None/$0 ,
Security,Lambda functions should be in a VPC,AWS Well-Architected Framework, p1 ,Ensure Lambda functions are located within a VPC. Steps: 1. Review function configurations. 2. Attach functions to a VPC if they are not. # REF:https://docs.aws.amazon.com/lambda/latest/dg/configuration-vpc.html,Cost: None/$0 ,
Security,RDS DB instances should prohibit public access,AWS Well-Architected Framework, p1 ,Ensure RDS DB instances prohibit public access. Steps: 1. Review RDS instance settings. 2. Modify public accessibility settings as necessary. # REF:https://docs.aws.amazon.com/AmazonRDS/latest/UserGuide/USER_VPC.html,Cost: None/$0 ,
Security,RDS snapshots should prohibit public access,AWS Well-Architected Framework, p1 ,Ensure RDS snapshots prohibit public access. Steps: 1. Review snapshot settings. 2. Adjust permissions to restrict public access. # REF:https://docs.aws.amazon.com/AmazonRDS/latest/UserGuide/USER_Snapshot.html,Cost: None/$0 ,
Security,KMS CMK policies should prohibit public access,AWS Well-Architected Framework, p1 ,Ensure KMS customer managed key (CMK) policies prohibit public access. Steps: 1. Review key policies. 2. Modify policies to prevent public access. # REF:https://docs.aws.amazon.com/kms/latest/developerguide/key-policies.html,Cost: None/$0 ,
Security,Redshift clusters should prohibit public access,AWS Well-Architected Framework, p1 ,Ensure Redshift clusters prohibit public access. Steps: 1. Review cluster settings. 2. Modify public access settings as necessary. # REF:https://docs.aws.amazon.com/redshift/latest/mgmt/security-using-VPC.html,Cost: None/$0 ,
Security,S3 bucket policy should prohibit public access,AWS Well-Architected Framework, p1 ,Ensure S3 bucket policies prohibit public access. Steps: 1. Review bucket policies. 2. Adjust settings to restrict public access. # REF:https://docs.aws.amazon.com/AmazonS3/latest/userguide/example-bucket-policies-s3.html,Cost: None/$0 ,
Security,S3 buckets should prohibit public write access,AWS Well-Architected Framework, p1 ,Ensure S3 buckets prohibit public write access. Steps: 1. Review bucket settings. 2. Set bucket policies to deny public write access. # REF:https://docs.aws.amazon.com/AmazonS3/latest/userguide/bucketpolicy-s3.html,Cost: None/$0 ,
Security,SageMaker notebook instances should not have direct internet access,AWS Well-Architected Framework, p1 ,Ensure SageMaker notebook instances do not have direct internet access. Steps: 1. Review SageMaker settings. 2. Adjust network configurations accordingly. # REF:https://docs.aws.amazon.com/sagemaker/latest/dg/notebook-instances.html,Cost: None/$0 ,
Security,Secrets Manager secrets that have not been used in 90 days should be removed,AWS Well-Architected Framework, p1 ,Remove Secrets Manager secrets that have not been used in 90 days. Steps: 1. Review secrets usage logs. 2. Delete unused secrets. # REF:https://docs.aws.amazon.com/secretsmanager/latest/userguide/manage_secret.html,Cost: None/$0 ,
Security,Auto Scaling launch config public IP should be disabled,AWS Well-Architected Framework, p1 ,Disable public IPs for Auto Scaling launch configurations. Steps: 1. Review launch configurations. 2. Set to disable public IPs. # REF:https://docs.aws.amazon.com/autoscaling/ec2/userguide/launchingASInstances.html,Cost: None/$0 ,
Security,Ensure the S3 bucket CloudTrail logs to is not publicly accessible,AWS Well-Architected Framework, p1 ,Ensure the S3 bucket that CloudTrail logs to is not publicly accessible. Steps: 1. Review bucket settings. 2. Adjust permissions as needed. # REF:https://docs.aws.amazon.com/awscloudtrail/latest/userguide/cloudtrail-s3-bucket-policy.html,Cost: None/$0 ,
Security,ECR repositories should prohibit public access,AWS Well-Architected Framework, p1 ,Ensure ECR repositories prohibit public access. Steps: 1. Review ECR settings. 2. Adjust repository policies to restrict public access. # REF:https://docs.aws.amazon.com/AmazonECR/latest/userguide/security.html,Cost: None/$0 ,
Security,EKS clusters endpoint should restrict public access,AWS Well-Architected Framework, p1 ,Ensure EKS cluster endpoints restrict public access. Steps: 1. Review EKS settings. 2. Modify endpoint access settings as necessary. # REF:https://docs.aws.amazon.com/eks/latest/userguide/network_restrictions.html,Cost: None/$0 ,
Security,ELB load balancers should prohibit public access,AWS Well-Architected Framework, p1 ,Ensure ELB load balancers prohibit public access. Steps: 1. Review load balancer settings. 2. Modify security groups to restrict public access. # REF:https://docs.aws.amazon.com/elasticloadbalancing/latest/userguide/load-balancer-security.html,Cost: None/$0 ,
Security,S3 public access should be blocked at account level,AWS Well-Architected Framework, p1 ,Block S3 public access at the account level. Steps: 1. Go to the S3 console. 2. Configure Block Public Access settings. # REF:https://docs.aws.amazon.com/AmazonS3/latest/userguide/block-public-access.html,Cost: None/$0 ,
Security,SNS topic policies should prohibit public access,AWS Well-Architected Framework, p1 ,Ensure SNS topic policies prohibit public access. Steps: 1. Review SNS topic policies. 2. Modify policies to restrict public access. # REF:https://docs.aws.amazon.com/sns/latest/dg/sns-access-policy.html,Cost: None/$0 ,
Security,SQS queue policies should prohibit public access,AWS Well-Architected Framework, p3 ,Ensure SQS queue policies prohibit public access. Steps: 1. Review queue policies. 2. Adjust policies to restrict public access. # REF:https://docs.aws.amazon.com/AWSSimpleQueueService/latest/SQSDeveloperGuide/sqs-access-policy.html,Cost: None/$0 ,
Security,SSM documents should not be public,AWS Well-Architected Framework, p1 ,Ensure SSM documents are not public. Steps: 1. Review SSM document settings. 2. Adjust permissions to prevent public access. # REF:https://docs.aws.amazon.com/systems-manager/latest/userguide/systems-manager-docs.html,Cost: None/$0 ,
Security,DMS replication instances should not be publicly accessible,AWS Well-Architected Framework, p1 ,Ensure DMS replication instances are not publicly accessible. Steps: 1. Review DMS settings. 2. Modify accessibility settings as necessary. # REF:https://docs.aws.amazon.com/dms/latest/userguide/CHAP_Replication.html,Cost: None/$0 ,
Security,ES domains should be in a VPC,AWS Well-Architected Framework, p1 ,Ensure Elasticsearch (ES) domains are located in a VPC. Steps: 1. Review ES domain settings. 2. Modify settings to ensure they are launched in a VPC. # REF:https://docs.aws.amazon.com/elasticsearch-service/latest/developerguide/es-vpc.html,Cost: None/$0 ,
Security,OpenSearch domains should be in a VPC,AWS Well-Architected Framework, p1 ,Ensure OpenSearch domains are located in a VPC. Steps: 1. Review OpenSearch domain settings. 2. Modify settings to ensure they are launched in a VPC. # REF:https://docs.aws.amazon.com/opensearch-service/latest/developerguide/vpc.html,Cost: None/$0 ,
Security,EC2 instances should be in a VPC,AWS Well-Architected Framework, p1 ,Ensure EC2 instances are located within a VPC. Steps: 1. Review EC2 instance configurations. 2. Modify settings to ensure they are launched in a VPC. # REF:https://docs.aws.amazon.com/AWSEC2/latest/UserGuide/EC2_GetStarted.html,Cost: None/$0 ,
Security,Lambda functions should be in a VPC,AWS Well-Architected Framework, p1 ,Ensure Lambda functions are located within a VPC. Steps: 1. Review function configurations. 2. Attach functions to a VPC if they are not. # REF:https://docs.aws.amazon.com/lambda/latest/dg/configuration-vpc.html,Cost: None/$0 ,
Security,SageMaker notebook instances should not have direct internet access,AWS Well-Architected Framework, p1 ,Ensure SageMaker notebook instances do not have direct internet access. Steps: 1. Review SageMaker settings. 2. Adjust network configurations accordingly. # REF:https://docs.aws.amazon.com/sagemaker/latest/dg/notebook-instances.html,Cost: None/$0 ,
Security,Secrets Manager secrets that have not been used in 90 days should be removed,AWS Well-Architected Framework, p1 ,Remove Secrets Manager secrets that have not been used in 90 days. Steps: 1. Review secrets usage logs. 2. Delete unused secrets. # REF:https://docs.aws.amazon.com/secretsmanager/latest/userguide/manage_secret.html,Cost: None/$0 ,
Security,CodeBuild projects should not use an user controlled buildspec,AWS Well-Architected Framework, p1 ,Ensure CodeBuild projects do not use a user-controlled buildspec. Steps: 1. Review buildspec settings. 2. Configure buildspecs to use only approved versions. # REF:https://docs.aws.amazon.com/codebuild/latest/userguide/build-spec-ref.html,Cost: None/$0 ,
Security,API Gateway stage logging should be enabled,AWS Well-Architected Framework, p1 ,Enable API Gateway stage logging. Steps: 1. Review API Gateway settings. 2. Enable logging for stages as needed. # REF:https://docs.aws.amazon.com/apigateway/latest/developerguide/set-up-logging.html,Cost: None/$0 ,
Security,OpenSearch domains should have audit logging enabled.,AWS Well-Architected Framework, p1 ,Ensure OpenSearch domains have audit logging enabled. Steps: 1. Review OpenSearch settings. 2. Enable audit logging if it is not already enabled. # REF:https://docs.aws.amazon.com/opensearch-service/latest/developerguide/audit-logging.html,Cost: None/$0 ,
Security,CloudTrail trails should be integrated with CloudWatch logs,AWS Well-Architected Framework, p1 ,Integrate CloudTrail trails with CloudWatch logs. Steps: 1. Review CloudTrail settings. 2. Configure logging to CloudWatch. # REF:https://docs.aws.amazon.com/awscloudtrail/latest/userguide/cloudwatch-logs.html,Cost: None/$0 ,
Security,All S3 buckets should log S3 data events in CloudTrail,AWS Well-Architected Framework, p1 ,Ensure all S3 buckets log S3 data events in CloudTrail. Steps: 1. Review bucket settings. 2. Enable S3 data event logging. # REF:https://docs.aws.amazon.com/AmazonS3/latest/userguide/LoggingReferer.html,Cost: None/$0 ,
Security,ACM certificates should have transparency logging enabled,AWS Well-Architected Framework, p1 ,Ensure ACM certificates have transparency logging enabled. Steps: 1. Review ACM settings. 2. Enable logging if not already enabled. # REF:https://docs.aws.amazon.com/acm/latest/userguide/acm-logs.html,Cost: None/$0 ,
Security,Lambda functions CloudTrail logging should be enabled,AWS Well-Architected Framework, p1 ,Enable CloudTrail logging for Lambda functions. Steps: 1. Review function settings. 2. Enable logging for CloudTrail. # REF:https://docs.aws.amazon.com/lambda/latest/dg/monitoring-cloudwatchlogs.html,Cost: None/$0 ,
Security,CloudFront distributions access logs should be enabled,AWS Well-Architected Framework, p1 ,Enable access logs for CloudFront distributions. Steps: 1. Review CloudFront settings. 2. Enable logging for distributions. # REF:https://docs.aws.amazon.com/AmazonCloudFront/latest/DeveloperGuide/monitoring-using-logs.html,Cost: None/$0 ,
Security,3.10 Ensure that Object-level logging for write events is enabled for S3 bucket,AWS Well-Architected Framework, p1 ,Ensure object-level logging for write events is enabled for S3 buckets. Steps: 1. Navigate to S3 bucket settings. 2. Enable logging for write events. # REF:https://docs.aws.amazon.com/AmazonS3/latest/userguide/LoggingReferer.html,Cost: None/$0 ,
Security,3.11 Ensure that Object-level logging for read events is enabled for S3 bucket,AWS Well-Architected Framework, p1 ,Ensure object-level logging for read events is enabled for S3 buckets. Steps: 1. Review bucket logging settings. 2. Enable logging for read events. # REF:https://docs.aws.amazon.com/AmazonS3/latest/userguide/LoggingReferer.html,Cost: None/$0 ,
Security,EKS clusters should have control plane audit logging enabled,AWS Well-Architected Framework, p1 ,Ensure EKS clusters have control plane audit logging enabled. Steps: 1. Review EKS settings. 2. Enable audit logging if it is not already enabled. # REF:https://docs.aws.amazon.com/eks/latest/userguide/control-plane-logs.html,Cost: None/$0 ,
Security,ELB application and classic load balancer logging should be enabled,AWS Well-Architected Framework, p1 ,Enable logging for ELB application and classic load balancers. Steps: 1. Navigate to load balancer settings. 2. Enable access logs. # REF:https://docs.aws.amazon.com/elasticloadbalancing/latest/userguide/load-balancer-access-logs.html,Cost: None/$0 ,
Security,RDS DB instances should be integrated with CloudWatch logs,AWS Well-Architected Framework, p1 ,Integrate RDS DB instances with CloudWatch logs. Steps: 1. Review RDS instance settings. 2. Enable logging integration with CloudWatch. # REF:https://docs.aws.amazon.com/AmazonRDS/latest/UserGuide/USER_LogAccess.html,Cost: None/$0 ,
Security,AWS Redshift audit logging should be enabled,AWS Well-Architected Framework, p1 ,Enable audit logging for AWS Redshift. Steps: 1. Review Redshift settings. 2. Enable audit logging if it is not already enabled. # REF:https://docs.aws.amazon.com/redshift/latest/mgmt/caudit.html,Cost: None/$0 ,
Security,Route 53 zones should have query logging enabled,AWS Well-Architected Framework, p1 ,Ensure Route 53 zones have query logging enabled. Steps: 1. Review Route 53 settings. 2. Enable query logging for DNS queries. # REF:https://docs.aws.amazon.com/Route53/latest/DeveloperGuide/query-logging.html,Cost: None/$0 ,
Security,S3 buckets object logging should be enabled,AWS Well-Architected Framework, p1 ,Ensure S3 bucket object logging is enabled. Steps: 1. Review bucket settings. 2. Enable object logging if not already enabled. # REF:https://docs.aws.amazon.com/AmazonS3/latest/userguide/LoggingReferer.html,Cost: None/$0 ,
Security,VPC flow logs should be enabled,AWS Well-Architected Framework, p2 ,Enable VPC flow logs. Steps: 1. Review VPC settings. 2. Enable flow logs to capture traffic data. # REF:https://docs.aws.amazon.com/vpc/latest/userguide/flow-logs.html,Cost: None/$0 ,
Security,Elasticsearch domain should send logs to CloudWatch,AWS Well-Architected Framework, p1 ,Ensure Elasticsearch domains send logs to CloudWatch. Steps: 1. Review domain settings. 2. Enable log shipping to CloudWatch. # REF:https://docs.aws.amazon.com/elasticsearch-service/latest/developerguide/es-logs.html,Cost: None/$0 ,
Security,At least one multi-region AWS CloudTrail should be present in an account,AWS Well-Architected Framework, p1 ,Ensure at least one multi-region AWS CloudTrail is present. Steps: 1. Review CloudTrail settings. 2. Create a multi-region trail if none exists. # REF:https://docs.aws.amazon.com/awscloudtrail/latest/userguide/cloudtrail-create-and-update-a-trail.html,Cost: None/$0 ,
Security,Database logging should be enabled,AWS Well-Architected Framework, p1 ,Enable database logging. Steps: 1. Review database settings. 2. Enable logging features as needed. # REF:https://docs.aws.amazon.com/AmazonRDS/latest/UserGuide/USER_LogAccess.html,Cost: None/$0 ,
Security,VPC flow logs should be enabled,AWS Well-Architected Framework, p2 ,Ensure logging is enabled on AWS WAFv2 regional and global web access control list (ACLs). Steps: 1. Review WAF settings. 2. Enable logging if not already enabled. # REF:https://docs.aws.amazon.com/waf/latest/developerguide/logging.html,Cost: None/$0 ,
Security,Logging should be enabled on AWS WAFv2 regional and global web access control list (ACLs),AWS Well-Architected Framework, p1 ,Ensure at least one trail is enabled with security best practices. Steps: 1. Review CloudTrail settings. 2. Enable security best practice configurations. # REF:https://docs.aws.amazon.com/awscloudtrail/latest/userguide/cloudtrail-best-practices.html,Cost: None/$0 ,
Security,At least one trail should be enabled with security best practices,AWS Well-Architected Framework, p1 ,Ensure AWS Config is enabled. Steps: 1. Review AWS Config settings. 2. Enable AWS Config if not already enabled. # REF:https://docs.aws.amazon.com/config/latest/developerguide/what-is-aws-config.html,Cost: None/$0 ,
Security,AWS Redshift audit logging should be enabled,AWS Well-Architected Framework, p1 ,Automate response to events. Steps: 1. Set up AWS Lambda functions or SNS notifications. 2. Define response actions. Cost: Variable depending on services used.  REF:https://docs.aws.amazon.com/lambda/latest/dg/with-sns.html,Cost: None/$0 ,
Security,AWS Config should be enabled,AWS Well-Architected Framework, p1 ,Ensure AWS Config is enabled. Steps: 1. Navigate to AWS Config settings in the AWS Management Console. 2. Enable AWS Config. # REF:https://docs.aws.amazon.com/config/latest/developerguide/what-is-aws-config.html,Cost: None/$0 ,
Security,BP03 Automate response to events,AWS Well-Architected Framework, p1 ,Automate response to events. Steps: 1. Set up AWS Lambda functions or SNS notifications. 2. Define response actions to events. Cost: Variable depending on services used.  REF:https://docs.aws.amazon.com/lambda/latest/dg/with-sns.html,Cost: None/$0 ,
Security,Elasticsearch domain should send logs to CloudWatch,AWS Well-Architected Framework, p1 ,Ensure Elasticsearch domains send logs to CloudWatch. Steps: 1. Review domain settings. 2. Enable log shipping to CloudWatch if not enabled. # REF:https://docs.aws.amazon.com/elasticsearch-service/latest/developerguide/es-logs.html,Cost: None/$0 ,
Security,ELB application and classic load balancer logging should be enabled,AWS Well-Architected Framework, p1 ,Enable logging for ELB application and classic load balancers. Steps: 1. Navigate to load balancer settings. 2. Enable access logs. # REF:https://docs.aws.amazon.com/elasticloadbalancing/latest/userguide/load-balancer-access-logs.html,Cost: None/$0 ,
Security,At least one multi-region AWS CloudTrail should be present in an account,AWS Well-Architected Framework, p1 ,Ensure at least one multi-region AWS CloudTrail is present. Steps: 1. Review CloudTrail settings. 2. Create a multi-region trail if none exists. # REF:https://docs.aws.amazon.com/awscloudtrail/latest/userguide/cloudtrail-create-and-update-a-trail.html,Cost: None/$0 ,
Security,Database logging should be enabled,AWS Well-Architected Framework, p1 ,Enable database logging. Steps: 1. Review database settings. 2. Enable logging features as needed. # REF:https://docs.aws.amazon.com/AmazonRDS/latest/UserGuide/USER_LogAccess.html,Cost: None/$0 ,
Security,VPC flow logs should be enabled,AWS Well-Architected Framework, p2 ,Enable VPC flow logs. Steps: 1. Review VPC settings. 2. Enable flow logs to capture traffic data. # REF:https://docs.aws.amazon.com/vpc/latest/userguide/flow-logs.html,Cost: None/$0 ,
Security,Logging should be enabled on AWS WAFv2 regional and global web access control list (ACLs),AWS Well-Architected Framework, p1 ,Ensure logging is enabled on AWS WAFv2 regional and global web access control list (ACLs). Steps: 1. Review WAF settings. 2. Enable logging if not already enabled. # REF:https://docs.aws.amazon.com/waf/latest/developerguide/logging.html,Cost: None/$0 ,
Security,At least one trail should be enabled with security best practices,AWS Well-Architected Framework, p1 ,Ensure at least one trail is enabled with security best practices. Steps: 1. Review CloudTrail settings. 2. Enable security best practice configurations. # REF:https://docs.aws.amazon.com/awscloudtrail/latest/userguide/cloudtrail-best-practices.html,Cost: None/$0 ,
Security,AWS Redshift audit logging should be enabled,AWS Well-Architected Framework, p1 ,Ensure AWS Redshift audit logging is enabled. Steps: 1. Review Redshift settings. 2. Enable audit logging if it is not already enabled. # REF:https://docs.aws.amazon.com/redshift/latest/mgmt/caudit.html,Cost: None/$0 ,
Security,ES domains should be in a VPC,AWS Well-Architected Framework, p1 ,Ensure ES domains are in a VPC. Steps: 1. Review Elasticsearch domain settings. 2. Ensure it is configured to run within a VPC. # REF:https://docs.aws.amazon.com/elasticsearch-service/latest/developerguide/es-vpc.html,Cost: None/$0 ,
Security,OpenSearch domains should be in a VPC,AWS Well-Architected Framework, p1 ,Ensure OpenSearch domains are in a VPC. Steps: 1. Review OpenSearch domain settings. 2. Ensure it is configured to run within a VPC. # REF:https://docs.aws.amazon.com/opensearch-service/latest/developerguide/domain-vpc.html,Cost: None/$0 ,
Security,EC2 instances should be in a VPC,AWS Well-Architected Framework, p1 ,Ensure EC2 instances are in a VPC. Steps: 1. Review EC2 settings. 2. Ensure all instances are launched within a VPC. # REF:https://docs.aws.amazon.com/AWSEC2/latest/UserGuide/launching-instance.html,Cost: None/$0 ,
Security,Lambda functions should be in a VPC,AWS Well-Architected Framework, p1 ,Ensure Lambda functions are in a VPC. Steps: 1. Review Lambda settings. 2. Ensure functions are configured to run within a VPC. # REF:https://docs.aws.amazon.com/lambda/latest/dg/configuration-vpc.html,Cost: None/$0 ,
Security,AWS Redshift enhanced VPC routing should be enabled,AWS Well-Architected Framework, p1 ,Ensure AWS Redshift enhanced VPC routing is enabled. Steps: 1. Review Redshift settings. 2. Enable enhanced VPC routing if it is not already enabled. # REF:https://docs.aws.amazon.com/redshift/latest/mgmt/enhanced-vpc-routing.html,Cost: None/$0 ,
Security,ELB application load balancers should have Web Application Firewall (WAF) enabled,AWS Well-Architected Framework, p1 ,"Enabling AWS WAF for ALB  helps to  protect web applications from common web threats like SQL injection, cross-site scripting (XSS), and DDoS attacks  , refer the links for implementation https://aws.amazon.com/blogs/aws/aws-web-application-firewall-waf-for-application-load-balancers/ and https://jadhavrohit.medium.com/integrating-aws-waf-with-aws-application-load-balancer-69377f946743  REF:",Cost: None/$0 ,
Security,API Gateway stage should be associated with waf,AWS Well-Architected Framework,p1,Ensure API Gateway stage is associated with AWS WAF. Steps: 1. Review API Gateway settings. 2. Associate with WAF to filter traffic. # REF:https://docs.aws.amazon.com/apigateway/latest/developerguide/apigateway-web-application-firewall.html,Cost: None/$0 ,
Security,CloudFront distributions should have AWS WAF enabled,AWS Well-Architected Framework,P1,Ensure CloudFront distributions have AWS WAF enabled. Steps: 1. Navigate to CloudFront settings. 2. Enable WAF association. # REF:https://docs.aws.amazon.com/waf/latest/developerguide/what-is-aws-waf.html,Cost: None/$0 ,
Security,EKS clusters endpoint should restrict public access,AWS Well-Architected Framework,P1,Ensure EKS clusters endpoint restricts public access. Steps: 1. Review EKS settings. 2. Adjust access settings to restrict public endpoints. # REF:https://docs.aws.amazon.com/eks/latest/userguide/pod-networking.html,Cost: None/$0 ,
Security,SageMaker models should have network isolation enabled,AWS Well-Architected Framework,P1,Ensure SageMaker models have network isolation enabled. Steps: 1. Review SageMaker settings. 2. Enable network isolation in model configuration. # REF:https://docs.aws.amazon.com/sagemaker/latest/dg/model-management.html,Cost: None/$0 ,
Security,SageMaker models should be in a VPC,AWS Well-Architected Framework,P1,Ensure SageMaker models are in a VPC. Steps: 1. Review model settings. 2. Configure to operate within a VPC. # REF:https://docs.aws.amazon.com/sagemaker/latest/dg/sagemaker-setup.html,Cost: None/$0 ,
Security,SageMaker notebook instances should be in a VPC,AWS Well-Architected Framework,P1,Ensure SageMaker notebook instances are in a VPC. Steps: 1. Review notebook settings. 2. Configure to run within a VPC. # REF:https://docs.aws.amazon.com/sagemaker/latest/dg/notebooks.html,Cost: None/$0 ,
Security,SageMaker training jobs should have network isolation enabled,AWS Well-Architected Framework,P1,Ensure SageMaker training jobs have network isolation enabled. Steps: 1. Review training job settings. 2. Enable network isolation if not already set. # REF:https://docs.aws.amazon.com/sagemaker/latest/dg/train-jobs.html,Cost: None/$0 ,
Security,SageMaker training jobs should be in VPC,AWS Well-Architected Framework,P1,Ensure SageMaker training jobs are in VPC. Steps: 1. Review training job settings. 2. Ensure they are configured to run within a VPC. # REF:https://docs.aws.amazon.com/sagemaker/latest/dg/training.html,Cost: None/$0 ,
Security,DMS replication instances should not be publicly accessible,AWS Well-Architected Framework,P1,Ensure DMS replication instances are not publicly accessible. Steps: 1. Review DMS settings. 2. Ensure replication instances are private. # REF:https://docs.aws.amazon.com/dms/latest/userguide/CHAP_Security.html,Cost: None/$0 ,
Security,EBS snapshots should not be publicly restorable,AWS Well-Architected Framework,P2,Ensure EBS snapshots are not publicly restorable. Steps: 1. Review snapshot settings. 2. Disable public access. # REF:https://docs.aws.amazon.com/AWSEC2/latest/UserGuide/ebs-snapshots.html,Cost: None/$0 ,
